filename,terms
1243534991021219840.png,the mete net ewe mobile award row building tar best for raw fully ito globe action delay eel mere around climate wee aces die zoom mob
1245031918493630464.png,best nurse for mobile fully delay action row illinois climate chicago mob eel building
1232747447631384580.png,with stopped renee through can call dawn drop replicating internally they part everyone chinese which literally trump last think say americans just time basically all currently diamond other someone this elite put seek chicago remotely stall deemed cured assassination reactivated person ship remote interest test been inhaling wave being smart finished equipped has others the into run functions controlled space mock while for add globe non power body cruise were dust was stopping 5g one are any compliant nurse becomes installed princess organ illinois and wuhan dead believe breathing activated virus digitized technology force your contained well using combination mandatory like created that controllable not countries when digitally waves fall specifically given turned why
1250817877315387393.png,with stopped through can call dawn drop replicating internally they part which chinese everyone literally trump last think say americans just time basically all currently diamond other someone this elite put remotely stall deemed cured assassination reactivated person iota ship remote interest test been inhaling wave being smart finished equipped has others the into run functions controlled space mock turned while for add globe non power body were dust was stopping 5g one are any compliant becomes installed princess organ and wuhan dead believe breathing activated virus digitized technology force your contained well using combination mandatory like created that controllable not countries there when digitally waves fall specifically given cruise why
1246378283421310976.png,iota there not
1256240738121236482.png,
1248595469154074625.png,items with users april theory canvasses december advice tar babel issues regarding minted cities pandemic considered critical violence symbolism important can perished 19 some currency hazard suggests noteworthy what collected topics from across understand reactionary act activity general territories channels awareness related infected online active associated alleged global countermeasures cases all other platforms this over seed people threads health insight been follow undermines million lead continue aspects society its unmistakable has pertinent the news into propagation sources mobile covid none material information implemented claim dynamic particular detected have media globe more happening conspiracy spread official but often advent china covering errs captured street including mitigate newly also topic such persistently presents between 5g one having developments originated these world too states coverage summary and wuhan recent babe virus technology celebrities tool help your abound variety claims theories ability cover coronavirus social that than around narratives countries array impacts relationship languages overall numerous effects various end public
1232394004182028289.png,items with users april theory canvasses december disclose advice tar babel biological issues regarding minted cities pandemic considered critical violence symbolism actually important can perished 19 some currency hazard suggests noteworthy what collected topics from across understand reactionary happened act activity general territories channels awareness related warfare infected online active associated let alleged global countermeasures cases all other platforms this over seed people threads health frequency insight been follow undermines million lead continue aspects society its unmistakable has against pertinent the news into propagation sources mobile covid none material information implemented anyone push claim went dynamic particular for detected have media globe more happening plague body conspiracy mae spread official but often advent china covering errs captured street including mitigate newly also topic such persistently presents between 5g family one having developments originated these world too states law coverage summary and wuhan recent babe virus technology celebrities help your human abound variety claims theories ability cover mandatory coronavirus because effect social that than around not narratives countries array there impacts relationship languages overall numerous effects various end public
1248136447166533632.png,the law warfare into let disclose december push anyone went for your human biological this plague body actually mae mandatory because china effect that frequency not there what family happened against
1222598223732203520.png,like met have adversary one this
1236004757644419074.png,ere hare down the news buying fire have comment this goods can over coronavirus like woke people met present shelf that cat pulled entire they town stay adversary one stuff
1250571717115883520.png,the hare down news buying naomi fire david comment goods can over coronavirus woke people liked present shelf that cat pulled entire they town stay stuff
1253227083653771264.png,david liked 5g naomi and pea overview work eke technology
1247662865894510593.png,the forwarded stop exactly every pea and has really technology buzzing virus setup for week need off loud this share actually noise cover covers but initial that test causing done network being minute they please 5g clapping construction lets work government something which
1249584584796155911.png,stop april cree mouth nose buzzing setup through week share actually can 19 travel they covid19 clapping forwarded radio infected every really lee spreading off this yet covers people their person cannot test causing erode being networks please mat speaks has the mobile covid for have spread but network also minute 5g construction lets work government viruses coughs exactly and virus need eyes loud sneezes fact noise cover coronavirus touching initial that not countries done many when respiratory eye waves something which
1228865588090458112.png,mobile infected cree covid pate lee spreading have fact spread coronavirus 19 person that not countries erode aid networks many when 5g eye mat covid19 waves
1247650654744543232.png,they ate pate can lie rate
1246825025652621320.png,can ate
1255673184952758273.png,met
1256896458105782272.png,please the david for met campaign morgan credit manager behind group felt share claiming
1253503083897905152.png,please the david for campaign morgan credit manager behind group share claiming
1247792244960026624.png,hello everyone
1249652959031386112.png,for eat stems education educators online students hello everyone and
1237721011740725248.png,the news education online and pat bank tag for first educators students sky owe says breaking son england interest chancellor nay shortly his budget cut delivering main live rate from stems has
1247489499430637570.png,the news and bank sky first edited science says jesuit republic england interest chancellor shortly his budget cut from main delivering rate live letters has
1147671306026070016.png,the with subject appropriate summary issuance and hold judgment sealed discovery those will for our other court edited science non strong materials remaining ill minimal mandate jesuit but record issue access presumption republic district conclusion connection lesser still directed relevant upon motions substantial letters summarize motion are submitted review individually public follows
1227715367889506304.png,the with subject appropriate summary issuance and hold judgment sealed discovery those will for our other court remaining non strong materials minimal mandate but bad record issue access presumption district conclusion connection lesser still directed relevant upon motions substantial summarize motion are submitted review individually public follows
1248234038684499968.png,series bad
1254398133015949312.png,ere poe series pen
1254492982214111234.png,max ere the good isolating tracing with special yes subject ending size april plan and change pew phase all delivery tourists services restaurants require duration weeks home tentative opening non school minimal limited open social risk poe ode pen group symptomatic phases population second order visitation hygiene travel mask only stay protecting dates contact events residents guidelines wearing ends retail
1254510348889026560.png,max yes with ending april confronting delivery gates restaurants duration leader school bad 19 group population second bill only contact tracing isolating suggestion size all will most this minimal risk phases hygiene stay bear the ere situations subject plan covid change phase require weeks opening non burden symptomatic agrees mask protecting dates events residents guidelines ends retail good states special and developing pew poor services home tentative should limited open social that countries order visitation wearing brunt
1247829675902144512.png,the ere suggestion states with situations confronting covid developing poor will gates most this leader burden should bad 19 that countries agrees bill bear brunt
1246514580483964931.png,under way and lee keel see clot testing coronavirus emerson milan leaned inter cray sign fade chelsea keen ray
1249639470321852417.png,cray emerson fade sign under way and inter milan lee chelsea keen eke keel testing coronavirus
1246407590923378690.png,eke rae telecommunication
1258191896767324161.png,rae telecommunication
1242553898172321793.png,ely roe track dow jones indus
1254997954546380804.png,the down cite friendlier andrew poison pill and heal moving safe step indus surgery your through for pusey you era helps protect home should keeping more men dow discs adult nuclear health pinched guide healing spine keep tear hydrogen from jones steed yourself sharp benefits slipped without diabetes therapy 5g tea heart addiction lear art longer diet nerves
1221836514038030337.png,the down outbreak cite friendlier andrew poison pill and heal moving wuhan safe step surgery your for through toll withholding you weekend era about helps protect home should keeping more men least over discs adult coronavirus city nuclear admits health pinched keep healing spine five tear mayor left hydrogen from sharp yourself million death benefits slipped without diabetes therapy 5g heart residents addiction art longer diet jumps nerves
1246115264728641542.png,the outbreak wuhan coo weekend toll withholding about least over coronavirus city admits five mayor left million death residents jumps
1252166380239101958.png,radio april mobile infected cree covid mouth lee nose coo spreading through have eyes sneezes fact yet spread can coronavirus 19 touching people their person cannot that coughs not countries erode also networks travel many when respiratory 5g eye mat covid19 waves speaks viruses
1250461502974328837.png,mobile infected cree covid lee spreading have fact spread coronavirus 19 person that not countries erode networks many when 5g eye mat covid19 waves
1228881686521405441.png,per inside pay pen
1242567826713366528.png,ere supporting the items net outside rae orange just and businesses san store all void for see you home non least eel tree namesake grocery mayor essential thursday county cannot jerry pen restaurant starting keep order cue cease ace cats closing cites stay pharmacy race food exercise residents corn pay joined purchase keen six
1253530065234608128.png,items with shared college arrives holds store san feed grocery some tap click clever his latch from they only radiation lookout after outside online just now spreading report you eel claimed people cannot million ace stay pharmacy ere the stimulus followers for have media woody hanover slew least conspiracy spread payment right essential exacerbating tactics food exercise 5g are purchase and celebrities your ready anything need theater home theories virtually coronavirus like who social keep that order cue when keen six thing
1227323668260368393.png,the stimulus with shared college online and followers arrives holds celebrities sheet now spreading your for ready anything have you need media feed woody theater report hanover slew conspiracy theories spread virtually claimed like coronavirus some people who payment right social tap that click clever his tactics latch from million they when only 5g are lookout radiation after thing
1238967295659184129.png,19 pan pen wee slice sheet
1234584264810754048.png,ere sao ant pen slice
1246479439611006977.png,ere the theory alight both and response nonsense taking linking technology virus masts those referring sao need emergency you about home pandemic absolutely action critical this conspiracy fives says theories communications tackle can people who disgusted infrastructure that dangerous would asked outraged incidents population here being set stay 5g read are general against
1233268960717688832.png,the theory alight both and response nonsense taking linking technology virus masts those referring you need emergency about home pandemic absolutely action critical this conspiracy says theories communications tackle can people who disgusted infrastructure that dangerous would asked outraged incidents poole population doodle here being set stay 5g read are its general against
1248316479130357760.png,per eked doodle ice
1241982095896920064.png,idiot fresh eked art
1247189659903561728.png,the shoulders thread will for national about samuel this coach nigeria who team short blame head tell clemens super truth fresh eagles laid former has idiot
1245699776156327937.png,the shoulders thread will for national about samuel this coach nigeria who team short blame head tell clemens truth eagles laid former has super
1247072332436459522.png,pad rod ann vase reed are rend rat lou mae
1251147182318563328.png,outbreak emergency covid rend rat ann disease coronavirus
1238381785223815169.png,coronavirus
1248652982125768704.png,
1244981232871579648.png,
1246792827788570624.png,embrace
1247097101625876480.png,
1233734504319078402.png,
1254425871689097218.png,ovid all pay wipe
1251303854764744704.png,19 ere ovid wipe rye pay oars fell mid lie all
1245610502161444864.png,19 ere hey oars
1247953799102320641.png,ned
1253581192202522624.png,ned
1220369485955096576.png,
1245233207135686656.png,19 services temporarily our timetables are and changing covid due
1203823970484535296.png,19 services temporarily our timetables are and changing covid due
1241544706573635589.png,
1255379305980407808.png,the next connectivity generation fee
1249011233661075457.png,the next connectivity life generation fee get guy did
917234428266602497.png,the guy get did
1241836247930351620.png,sunglasses
1245638915098173442.png,bees rae sunglasses aye bee
1258454968971022336.png,how for rae aye decisions making scotland
1251824688466210816.png,ail how for sag peg fee meet decisions making scotland
1237740783215747075.png,ail meet sag peg
1247811041469165568.png,the developments account country for your you where promoted official but leading here follow welcome 5g are twitter date
1247106588667674624.png,the news developments account say covid and country claim technology biologically for your you helps reality where promoted conspiracy official coronavirus but 19 bib theorists rubbish leading scientists that connection here follow verdict from welcome complete impossible between 5g transmit are check twitter date idea
1205298792985051136.png,the news say covid and technology claim biologically helps reality conspiracy coronavirus bib 19 theorists rubbish scientists that connection verdict from impossible between 5g transmit check complete idea
1252182483766034435.png,give derby
1247707611719442432.png,the with therefore pot just and had anyone post give all now could your quite for you need about case this keeping more share conspiracy actually posts following making nowhere suddenly people away lot sense passed right that social large keep recently were pam not his been correct here follow was dad relic whole 5g eye posting wake maybe out something
1246082353698615297.png,the with pot therefore just and had anyone post all now could your quite you need about case this keeping more share conspiracy actually posts following making nowhere suddenly people away lot sense passed right that social large recently were not his hay been correct here follow was dad whole 5g pan posting wake maybe out something
1229351280679645184.png,the arrangements outbreak working accordingly with situations security users instead online just concerned and cancel possible time change updated announced tuned all ensure will scope apologize madrid sorry for you our media about new support share view barcelona partners soon inconvenience participation coronavirus novel local caused friends product that decided order thanks been was understanding from please launch stay current pan effects since are inform extent originally launched globally event alternatives has planned public
1253442478356795393.png,the arrangements outbreak working accordingly with situations security users instead online just concerned and cancel possible time change updated announced tuned all ensure will scope apologize madrid sorry for you our media about new support share view barcelona partners soon inconvenience participation coronavirus novel local caused friends product that decided order thanks been was understanding from please launch stay current effects since are inform extent originally launched globally event daily alternatives has planned public
1249774356902735882.png,save tan daily lives coronavirus
1242898959443451904.png,lives save
1248321682642788357.png,
1257119143544926209.png,doctor ant this malt vice
1245247079791894528.png,the states doctor already and country space gloved hospitals for ant new malt more patients coronavirus searching house neva expect york many epidemic across are masked mel urgently
1227813480511819779.png,the states confirmed already ice and country cases space gloved hospitals for facts new more fiction patients coronavirus searching house expect projected york many february epidemic across deaths are mel masked urgently
1255692063703658497.png,february facts confirmed deaths projected fiction cases coronavirus
1228024768735039488.png,woe wee
1256465827672526849.png,19 net strategy 5g source june july thousands adds sept korea woe wee south may subscriptions
1247532212683075589.png,states net confirmed updated sept worldwide iran kingdom ago thousands may subscriptions spain source about this adds italy 19 united data strategy china than location korea less recovered south 5g june france africa july vial
1246042619743997952.png,the world states prey news nurse confirmed updated year had kingdom worldwide iran becoming ago hoe pet spain have unit source sky about two weeks this east old critical believed london italy nightingale collaborates underlying breaking united data china open who health than largest care been location less was recovered south set france africa work has brilliant began after
1247443249444188160.png,the world news nurse with confirmed cope year had stressed becoming hoe pet overwhelmed help have unit you feeling two weeks old east critical believed collaborates london nightingale underlying breaking people stress open who health than largest care young been less was set are habits work has meet brilliant began after
1226765905306234881.png,with approximately college update cope fatality stressed overwhelmed help for report you feeling infections severity people stress ratio young are habits imperial meet
1255779370079145986.png,severity for approximately report ratio college update fatality infections imperial
1245796895609552902.png,lest
1246108982974058501.png,lest hal ears direction eel solution
1222406440834469888.png,direction ann solution hal
1250858829220392961.png,fruit will tomorrow full pickers ann plane land
1258526034875441153.png,the message with vic full pickers just and cope anyone unclear will someone case behind this always plane actual stand what been was stream from fruit tomorrow sent has land
1242035876961673217.png,the furs message with vic just and cope anyone unclear fury someone case behind this always actual stand what been was stream from sent has
1233457586093150215.png,oil furs world ryan michael health lit buy director was organization
1240696850895605761.png,world the michael reported buy iran will first pop oasis italy coronavirus 19 data china actual that not countries population isis korea director was south million death oil ryan black since deaths are per big days follows
1236405448393117696.png,ritz world the news reported confirmed months and riyadh iran cases ada will businessmen first pop italy confined nearly coronavirus 19 data china anon actual eats that ode not were countries population korea south million death black eat jackson since deaths are detained carlton per hotel big days follows
1245017501173518356.png,news aid eat jackson confirmed bear ode induce dutchess monroe nassau nearly cases coronavirus
1247671977206263808.png,the saul mobile bridge cam noon spectrum report version road national edit dutchess share view behalf house infrastructure commission final consulting 5g bear nassau contact tools doc riverside
1239608589783793664.png,the saul mobile bridge cam noon spectrum report version road national edit share view behalf house infrastructure commission final consulting 5g contact tools doc
1231119609228603392.png,image ken
1238375091454595072.png,image ken
1236110498837540864.png,pass age sane met see red one
1258494803202969600.png,age awe sane eras red mobile one man are pans population lee earnings results welcome
1258293724070547456.png,pod the world sprint same net nationwide ere looking mobile capabilities plan and ever month even deploying awe will for our best paw peer doubled more employees low record temporarily unlock eras potential customer performance pans cosy population earnings what results did welcome build 5g forward are priced act branded customers additions has connect expanding ben
1252564478090084352.png,pod ere the sprint world nationwide looking mobile plan and ever even deploying for our peer doubled more employees low record temporarily unlock potential customer performance what did forward priced customers additions has connect
1243688073533239298.png,east the brave
1248662563736489990.png,east brave
1248924790833983489.png,fiend
1243721201324658690.png,fiend
1220707815523803142.png,pie china ate are agree wee all
1246753894404890624.png,ate sing agree
1252233437345271808.png,bites sing
1239462303227097088.png,
1233202431514705920.png,
807132012914020352.png,landmark the rights states vietnam place however lincoln and march bar before available thousands women permit rallying for will after most site national rallies weeks committee this protests blocked donald won during historic following blocking civil behalf presidential planning united guardian access massive service avenue monument man washington course been from pennsylvania million many according inauguration take anti park memorial mall which omnibus has days filing trump
1219317208205209600.png,landmark the rights states vietnam place however lincoln and march bar before available thousands women permit rallying for will after most site national rallies weeks committee this protests blocked donald won during historic following blocking civil behalf novel presidential planning united guardian access massive service avenue monument man washington course been from pennsylvania million many according inauguration take anti park memorial mall which omnibus has days filing trump
1247808321148477442.png,novel with friends you family plus happy landlord easter and can period
1240577802723897349.png,with plus and tag you red happy landlord ant easter eve can friends ore wee cry pry preys family period
1240310180455342083.png,cry central outbreak bankers ate dis meeting hold fears eve ore due lee sell wee coronavirus
1258184855847948289.png,sip mobile dis sell hold amy lee ale awe fans bankers eyes meeting central slip ate population ore earnings results roy welcome yon are ray
1247124663924211713.png,jacob sip the mobile believe ale awe fans eyes beginning witnessing population ore earnings results roy welcome are ray trouble
1243201267343732736.png,jacob the lined vie beginning witnessing believe trouble
1247139883430354944.png,any inn rare lined
1245076136968753152.png,any rarest inn
1258532139974266880.png,rarest
1246691789345558531.png,
1247436896168554496.png,
1247405011358740481.png,out
1247924885239840768.png,out
1253773718129479686.png,peep safer home coronavirus
1248972054952644608.png,sonny safer neal sue wigs rae home pat ass roy seen hoe coronavirus
1251355759763316738.png,pet sonny wigs reed pat roy
1042168380910960640.png,pet pusey you reed course what know comer
1246177723720097792.png,you know what
1240045272106823680.png,security covid and breaches fraud ago your our today morgan see have comment community pregnancy maternity ashley can ward coronavirus like but 19 standards false advertising early health things else babies prevent precautions goes hours one lane days against these
1224610342119985152.png,tau security covid and breaches fraud ago your our today morgan see have comment community pregnancy maternity ashley can ward coronavirus like but 19 standards false advertising early health things else babies prevent precautions goes hours one lane are days against these
1179234358655426561.png,camp see rome one two breach assist are insurance support pay sines dossier intel twenty vial ned clown
1253676287757037577.png,see camp rome one two breach pay rae sines support intel lane dossier ore twenty vial ned
1253949644763287552.png,lane rae pan
