filename,terms
1247210224412434440.png,with stopped attempted through our can call drop depend replicating internally they part which chinese everyone literally trump combat last think say americans just time basically all currently diamond other someone this elite remotely deemed lives cured assassination vehemently reactivated person ship remote test been inhaling wave smart equipped has reject the run functions controlled space mock turned for add globe non body issue were dust was 5g one are any compliant becomes princess organ and wuhan dead breathing activated virus digitized technology force your need contained well using combination mandatory like created because that controllable countries when digitally waves fall specifically given cruise why
1248320458614886406.png,vie
1236033675575336960.png,ere see vie are were
1239757723786342402.png,map 5g confirmed cases were virus
1244642972068708353.png,pie stoves map 5g confirmed site cases sir feet johns viewer saturn street meg station lie virus lang
1243600304429555714.png,with stopped attempted through our can call drop depend replicating internally they part everyone chinese which literally trump combat last think say americans just time basically all currently diamond other site someone this elite remotely saturn deemed lives cured assassination vehemently reactivated person feet ship remote test been inhaling wave smart stoves equipped has meg reject the viewer run functions sir controlled space mock for add globe non body cruise issue were street dust was 5g one are any compliant becomes princess organ and wuhan dead breathing activated virus digitized technology force your need contained well using combination mandatory like created because that controllable countries when digitally waves fall specifically given turned why
1238144434149003264.png,with stopped attempted through our can call drop depend replicating internally they part which chinese everyone literally trump combat last think say americans just time basically all currently diamond other someone this elite thoughts remotely deemed lives cured assassination vehemently reactivated person ship remote test been inhaling wave smart equipped has reject the run functions controlled space mock turned for add globe non body issue were dust was 5g one are any compliant becomes princess organ catching and wuhan dead breathing activated virus digitized technology force your need contained well using combination mandatory like created because that controllable countries when digitally waves fall specifically given cruise why
1241296623696781312.png,red think catching thoughts thin
1246375867393224704.png,thin light went therefore
1233147154316681216.png,the thus with therefore showing properly han hit and hemoglobin molecule country went all now published causes rotation unbelievable specific this ultimate more fact spin inhibiting solution throughout ability via city absorbed oxygen molecules that frequency around would what truly such impact when backed below one electrons compared light waves pilot problem unleashed work comparisons has happens symptoms these
1249491266523615232.png,the thus ere with properly showing han hit and hemoglobin molecule country all now published causes poplin rotation unbelievable specific this ultimate more fact spin inhibiting solution throughout ability via city absorbed who oxygen molecules that frequency around would anal population what truly such impact when backed below one electrons compared waves problem pilot unleashed work comparisons has happens symptoms these
1246561037693751297.png,ere sabbath who deacon class anal population tune
1249412119398883329.png,impact will gin untested its deacon class and lee mental lethal emotional planned tune
1244640181044609024.png,will gin untested its and lee mental lethal planned all
1245655018096570370.png,the urban breaking news platform official nate
1244795273563512839.png,the urban breaking news platform official
1247210732141174784.png,how the people look world talented have want whole demographic months just might ores been fall those many
1240972864515383296.png,want the talented look how people have world whole demographic months just might ores been fall those many
1255022788047331330.png,eat
1247074694160961536.png,eat
1233394199334014976.png,use with undetectable enemy microwave behave arsenal possible amounts necessary enough japan country refers quantity own through biological react four purposefully first resonance terminal spin programs actually can normal perfect emerged aspect met would doctrine population prisoners reactivity navy greater exposure how they very without only experiments life across radiation activity millions tests military manner radio within used cause lab just monkeys amount will cooked subjects destroyed this notebooks exact similar illustrate following sacramento agents several people their war scientists frequency person test been develop being speed dose heating the confiscated american begin had may initially for have power citizens particles sprayed target house agent massive were entire thousand was minute death such chemical armies make impossible beings family one allows are deploy personally defeated these follows referred too homes behavior resonate and california especially technology weapon targeted human facet energy attacked exposed fact area ability weapons virtually testing examine times who because afterwards that than bombarded order done truth much bodies populations given small
1254933373790965765.png,use with undetectable enemy microwave behave arsenal possible amounts necessary enough japan country refers quantity own through biological react four purposefully first resonance terminal spin programs actually can normal perfect emerged aspect met would doctrine population prisoners reactivity navy greater exposure how they very without only experiments life across radiation activity millions tests military manner radio within used cause lab just monkeys amount will cooked subjects destroyed this notebooks exact similar illustrate following sacramento agents several people their war scientists frequency person test been develop being speed dose heating the confiscated american begin had may initially for have power citizens particles sprayed target house agent massive were entire thousand was minute death such chemical armies make impossible beings family one allows are deploy personally defeated these follows referred too homes behavior resonate and california especially technology weapon targeted human facet energy attacked exposed fact area ability weapons virtually testing examine times who because afterwards that than bombarded order done truth much bodies populations given small
1245355238212669440.png,tab lass
1249429201683468291.png,lass
1243533517813923843.png,hell
1246956455414071301.png,trying the radioactive hell cancer not notice can
1246697485579497474.png,trying the radioactive cancer bug not notice
1244043102039371776.png,bug ray
1249575821486043137.png,credit plan every and change existence freedoms knowledge all now based your today you control this reality happening power remove monitor can research there what move was called part knew digitize agenda warn others ray system
1243338559702077446.png,ere the credit ewe plan every and change existence freedoms knowledge tar all now based your today you control this globe reality happening power ito remove monitor can research around there what move was called die part knew she zoom digitize agenda warn others system
1242663316628987904.png,the die ewe around ito globe zoom tar carnal
1251143483491938309.png,carnal load see
1239437203631222785.png,the news too vigilant and year post governance have finally about corporate more advocate business boards said their than past chief left executive been they recognizing ire one job compliant why
1249231613629796352.png,the news too vigilant and post have finally about more advocate business boards said their son than chief left executive been they recognizing one job compliant why
1254152371929845761.png,yet
1246875059559575552.png,yet yes
1255279811158847491.png,the for media check fee won humans eel idiot out stops
1237553698902929410.png,for fee reaps humans eel stops
1246124510140674049.png,site cell public heal
1249293243390603264.png,into and heal anyone creates unless virus your anything you site protect men body living itself cleanse them cannot viruses not from catch injected are public
1237069540527308800.png,into and creates your you protect men body living itself cleanse them cannot not from injected catch are viruses
1252153937886457856.png,the within with cause proteins brought excretions cells few even contagious anything other see poisoned sate ross living because cell not things smart they when only part happen are solvent pieces out viruses
1236757695367127040.png,the nazi within with proteins brought excretions cells few contagious other see living because cell ate things they part are solvent pieces out viruses
1246535193369837568.png,see tea say class test mad periscope
1246803007058182144.png,periscope class tea
1252698745260646400.png,
1243973188444459009.png,
1257605450004140032.png,the pay protest
1244399799790600194.png,the yes 5g pay she protest
1248094279546920960.png,yes with sheer serum discussion own lifestyles pandemic mid during can unreasonable potential viewed would findings further process from exposure without epidemic substantially radiation safety smooth along hard unrealistic serious section reversing realistic exposures experience intrinsic degree able superimposed all handle most adverse this defense removed essentially likelihood minimal evidence people their sufficiently largest executive myriad been basis develop weakened systems damaging credible lead its latest experiment worked allowed history exhibited term validated system against symptoms the nature thus innate increase completely validation link had could for required have non unable degrades previous stimuli serve but research present copyright far including operation was imposition point between one medical are development attack having any approach implementation showed viruses these numbers hypothesis strikes line reported summary mainstream links and neutralize before type technology virus those transition based long immune human best contribute need exacerbation case specific should efficacy strong exposed well emergence studies testing coronavirus limited bottom times degrading who because taken that wireless not order there involved intended improved choice many gets succumbed resistance current outbreaks numerous adaptive effects counteract antibodies which
1237424802916425730.png,switzerland with sheer country serum discussion own first lifestyles cities pandemic mid italy during can unreasonable potential viewed would findings further process from exposure without epidemic substantially across radiation daily safety smooth municipalities along hard unrealistic serious section after ben reversing realistic exposures experience intrinsic degree kingdom able superimposed all now handle most blackberry adverse this defense premium removed essentially likelihood minimal evidence europe people their sufficiently largest interest cat executive myriad lao been basis develop weakened systems damaging credible followed edge lead its latest experiment worked allowed history exhibited motorola launched bert term validated system against symptoms the nature thus innate ran top rome increase completely bologna validation link had pro could for required have non unable degrades previous stimuli serve but research present copyright far five comments milan including operation was imposition sharp plum point between 5g ultra one june medical are development attack galaxy having any approach implementation showed viruses these numbers finland hypothesis strikes note line reported summary mainstream links and neutralize before type technology virus those transition based long immune human best contribute services need exacerbation case specific should efficacy strong exposed well emergence studies testing coronavirus limited bottom times degrading who because united taken joins that wireless turin not shortly order there involved intended improved choice many gets succumbed naples resistance current next outbreaks numerous adaptive effects counteract antibodies big which
1246478050860109829.png,the finland note switzerland with top ran rome bologna and kingdom pro country now services blackberry first cities italy premium europe united joins five comments turin interest cat milan shortly followed was edge sharp plum naples next 5g ultra june across its daily motorola launched galaxy municipalities bert big after ben
1247187829668577280.png,with occasionally december cells simply walls week first mid deployed mostly can fastest high advanced dawn second wide bringing from widely traversing down sprint upgrading extremely lab lower field most areas similar existing over difficulty their frequency wave being networks frequencies launched per predecessor indoor the capacity mobile covered may while cost required have close more often china boundary actual short usually above reaching between 5g better are ray reach states coverage lowers gigabit warns and speeds services millimeter using towers limited low united windows that many offers waves others which band
1242180597751205888.png,eliminates same with use green occasionally december cells possible reuse simply walls air free spectrum transmitted week first mid deployed mostly can makes fastest high advanced dawn second wide bringing from widely distance localized very traversing down sprint upgrading within radio extremely lab deployment ante kilometer lower field all dry blue most figure areas similar region existing over difficulty their frequency wave being networks frequencies atmospheric launched per detailed predecessor indoor the capacity severely mobile limits terminals covered space may while cost for required have close more often absorbed china boundary actual short usually oxygen above interference operation reaching also between percent 5g better one are ray too reach states coverage lowers gigabit warns and dense speeds services absorption millimeter range energy using towers limited low relative united windows that enables relationship traditional many offers benefit waves illustrates others which band
1256345778114658304.png,the too eliminates same with severely use green within radio deployment ante bid dense and limits kilometer possible link reuse space all free while absorption for dry blue air spectrum figure millimeter range transmitted you energy region makes relative absorbed oxygen high frequency interference enables operation relationship wave also traditional frequencies atmospheric very distance localized percent between one benefit detailed per illustrates out terminals
1258740149833420800.png,stop bid out link
1253758117973823488.png,havana stop springer syndrome
1240616792193527808.png,the ere cause shared springer generation and member information content ratings technology fifth hot works lees for about checking science fact more serene feedback reviewed yours coronavirus novel lasers false found that wireless pen not true stories been havana did learn lead 5g syndrome check mel ray others
1247508264042074113.png,ere april shared integrative consultant and member sydney information content brow ratings hot works lifestyle for about checking new science more fact coach serene feedback reviewed yours technologist guest entertainment spy false found health that host stories been talk live learn lead make tuesday food check mel others
1245362710684094471.png,make guest spy entertainment april technologist health food consultant host sydney coach brow live talk integrative lifestyle
1252859160661651458.png,discover your nearest map
1245964789576237056.png,research world your map april 5g updated announced field trials
1255885408858144768.png,research world map april 5g tie updated dig field trials
1247264466707918851.png,real working views get update now david save report version video new share london ban dig subscribed are subscribers
1253247400967315456.png,real working views get update now david save report version eels emergency video new share london mae ban department subscribed pad tea are mel coat lain subscribers
1246127990108495872.png,the theory sources covid and broadcasts ago celebrities technology now spreading for eels have monitoring about spread via coronavirus 19 some people several causing including stories been press being pad linked somehow hour 5g various photo minor regulator mel reputable has lain
1246009018210017280.png,the theory sources covid and broadcasts ago technology celebrities now spreading for have monitoring about spread via coronavirus 19 some people several causing including stories been press being linked somehow hour 5g various photo minor regulator reputable has
1257770349602758657.png,the poisoning rabies and mutate virus all aids immunity may will manifestations willy for your weapon media twitter web this replying research symptom apparatus build paid ultra 5g williams aware radiation agenda government
1247999815117672449.png,with theory april picked mutate detrimental immunity unclassified analyst pandemic replying 19 early his study swine build international yon paid covid19 radiation general after outbreak radio additional rabies march phone kingdom actor all now published will willy report role control comment this new deleted appears health jersey million state aware its agenda flu has the find poisoning mobile increase connectivity covid followers post may introduced for have media january woody non more conspiracy research apparatus negative ultra 5g protection seven rumor government showed began supposed world and links year speeds virus technology circulated aids manifestations your weapon long web about attacking fact spanish emergence towers coronavirus symptom united scientific social that than commission due according williams effects since waves twitter which
1239740007100940289.png,with theory april picked detrimental unclassified analyst feed pandemic 19 early his study swine yon international radiation general after outbreak radio additional march phone kingdom actor now published will report role control comment new deleted appears health jersey million state its flu has the find mobile increase connectivity covid followers post introduced have media january woody non more conspiracy negative 5g protection seven rumor showed began supposed world and links year speeds technology circulated long about attacking spanish emergence towers coronavirus united scientific social that than commission due according effects since waves which
1247231824159543297.png,bah pad mars pam amy any tate
1245609537526104065.png,and amy update for feature blows more share channel coronavirus watch pam follow subscribe roy tate whistle please 5g former boss
1248752021575876608.png,whistle please for follow watch 5g feature blows former and more share update per subscribe boss channel coronavirus
1244766023624077323.png,matt photo paine
1247243392830054405.png,matt photo paine
1248097931179298823.png,the think possible surrender cases all yesterday now minister today our need control sky new killing italy infectious says over look gone there announces here what complete prime one failure its deaths relief day earth three days disease
1246290347531132933.png,the think possible surrender cases all yesterday now minister today our need control sky new killing italy infectious says over look gone there announces here what complete prime one failure its deaths relief day earth three days disease
1248526658367361024.png,the classifications april confirmed located infected tanzania and especially number cases blocs despite virus free based belong different two case east where belonging like that major countries recoveries lesotho deaths are africa
1246541625251123206.png,the classifications april confirmed located infected tanzania and especially number cases blocs despite virus rand free based see belong different two case east non where belonging like that nay major countries recoveries lesotho seeker tea deaths are africa periscope
1236383095198187520.png,the seeker bike evolution life non blind acceptance rand
1246009679785922560.png,the illness with and diseases japan contagious ask other questions vanity someone evolution about certain exposed blind can usual nuclear sense that physicist not fair acceptance being catch bike one radiation
1257359571334692865.png,the illness with and diseases japan contagious ask other questions vanity someone about certain exposed can usual nuclear sense bus that physicist not fair roe mad wee being catch one radiation
1258118052845178881.png,cobalt radiation neutralize mad technology iron
1251890498962423808.png,cobalt radiation neutralize technology iron all
1246127198853050371.png,the theory sources covid and broadcasts ago technology celebrities all now spreading for have see red monitoring about spread via coronavirus 19 some people several causing including stories minutes been press being linked somehow 5g various photo minor regulator reputable has
1240415285481549827.png,the theory sources covid and broadcasts ago technology celebrities now spreading for see red have monitoring about spread via coronavirus 19 some people several causing including stories minutes been press being linked somehow 5g various photo minor regulator reputable has
1247949437801861120.png,west mad
1251459389417979904.png,the news real west led covid and change sad now all happening late view body breaking 19 staff guest liked comments chief others
1247269929700786177.png,led the news real covid and change sad now all happening late view body breaking 19 staff guest liked dare comments chief sealy rat others
1245445946122649604.png,age the coverage with mobile and ned mona slovenia croatia for our paces tunis more ian area rat options albania data ate poe displayed collected networks pros tirana lyre twang mars search since maps piracy belgrade sea
1252294128290971650.png,age the coverage with mobile deployment and ned slovenia for our paces delaying more area options call data poe collected networks pros twang mars since maps displayed doctors sea
1247284916569739270.png,the ere rene rue within base mobile deployment and limits phone residing meters humans all for damage india delaying dee peripheral exposed stations blood call vicinity effect wireless group were wet study from impact measurements below policy eat ensured end seas radiation lid payers public doctors
1243696807017885697.png,the rene rue ere within net base mobile ewe and limits phone residing meters humans all india ito peripheral globe exposed stations blood vicinity effect wireless around group were wet study from measurements below eat policy ensured end seas part radiation die she zoom public
1241648860004581376.png,the net die ewe around part ito globe zoom art babe
1253593704444682240.png,the arena with ernie inside duet carbon pilgrims run babe harvard curt delivery darpa see leer funded professor body stimuli normal bee coronavirus deere target trust person wireless released sets recently causing water immunization navy from live army ace charles 5g one contact society work three system
1251125521477402624.png,the arena with inside duet harvard curt delivery see leer professor body eel stimuli bee normal coronavirus deere target person released recently sees causing water immunization wee live charles 5g one contact work system sea
1247611824801013760.png,the proved updated none resignations sex remains provided hen eel yet cure ted sees pope lion sure what wee pest make when tea these sea
1252336716909875202.png,the make when proved tea pope updated remains none sure these
1243721342504931329.png,cry seat core bored poe rae county corn celery wuhan sal fall err deane corey try
1243191826900758529.png,rue cells air era celery surrounding side can err mute cereal high roe upon they take charged old eli gases most peer cure their nitric oxide ate fee vapor water basis degrade corrosive electrically corn acid symptoms the thus top oneness common ale have odes caused present voltage deane such death coral labeled 5g are these ozone and wuhan years virus those dot your nitrogen urn dioxide ceres son effect sues that conductor called corey lightning generate note sat
1247883022386356226.png,the ozone thus rue way and years gases those virus dot air symptoms nitrogen peer have urn era orbit dear surrounding dioxide can caused present nitric that oxide sues conductor vapor fee roe water sure degrade corrosive called electrically such from they coral labeled 5g acid charged are old generate eli these sat
1249069816129794049.png,the hare oxygen media ewe ate orbit dear check halt won dig jig idiot out from
1247553250221535233.png,awe hare oxygen ewe ate dig
1244741216622837760.png,awe
1245007433652670465.png,had
1251954982284230656.png,dale mat act mid rat alee
1254905415151861760.png,description the green radio states approximately advisory west sugar astronomy white zone latitudes and document march possible miles bank regulations facilities border receiving for november longitude national committee grove virginia square area communications following alee 19 federal united quiet commission frequency established harmful near docket interference encloses management was navy from state observatory black manual between map mat act per bounded day rat procedures land
