filename,terms
1238642344594935816.png,same with equipment company accordance multitude diverse america powers safeguard safe japan researchers humans prevention our series visit november congress evolution acting pandemic congressional independent funded during exhibition 19 emerged staff market isolation high gone anthony self relevant study from concluded how paid experiments tissues article daily safety customers chinese boasted investigation three military after trump angry outbreak additional attention outside strains lab warnings americans instructions time sour personnel collaboration worldwide arrival field all senior stenographers will other you control two tab prior new put this obsequious areas another employees challenging following europe telecommunication over participating team health scientists promoting priority draconian investigate escape virulent manipulated reward collecting darling meaningful studying has symptoms presentation disease the nature working raises subject organizing corporation future covid independently creating isolated ensure may could while disciplines for introduced responding have required officials media endemic weeks jumped always foot non actively taiwan least scrutiny spread official hostile research novel caused booth china mainland background service stand care including each resources was possibility billion undergo departure one are medical lucrative rather guidelines nationals samples government originated these closely world states reported laboratory and wuhan recent believe measures before virus president human affected infection engaging credibly strong pentagon coronavirus leaders created who united absurd that than narrative hybrid department countries prompted addition mainly bats cautioned press meetings prevent linked current level comfortable outbreaks trigger adopted steering
1246533465958420482.png,same diverse multitude powers america japan researchers humans november congress evolution acting pandemic congressional independent funded emerged 19 market gone anthony study from concluded how experiments tissues article chinese boasted investigation three military after trump angry outbreak strains warnings americans sour time collaboration worldwide field stenographers other tab another this obsequious new challenging following over team health scientists promoting draconian investigate escape virulent manipulated reward collecting darling studying has disease the nature ere raises subject future covid pore independently creating may could while disciplines introduced officials have media endemic foot jumped taiwan scrutiny spread official hostile research novel caused china background care each was possibility billion one medical lucrative rather samples government originated these world states reported laboratory and wuhan recent virus president human engaging credibly pentagon mutt men coronavirus created united who absurd that than narrative hybrid countries prompted cautioned bats press prevent linked trigger outbreaks steering
1215721789017534465.png,ere men
1258437973961510916.png,the with april think board just and hold phone names price those coo hill technology answers pretty facial hand for percentage human nothing see you george first rank amazing video this support more where body then mind can aspect some don out love open infrastructure their that harmful teacher class immediately correct accounted each was blowing ott much answer how they gets smart classroom government rolled 5g compared joe chinese track all has student recognition
1240348691086610432.png,the with april think board just and hold phone names price those hill technology answers all pretty facial hand for percentage human nothing see you george first rank amazing video this support more where body then mind can aspect some don out love open infrastructure their that harmful teacher class immediately correct ott each accounted was blowing much answer how they gets smart classroom government rolled 5g compared joe chinese track has student recognition
1246783875206037511.png,the news have four false 5g that attacked phone link been theories masts further over coronavirus
1229762426339414016.png,toy the news have four false 5g that attacked phone link been any theories masts further over coronavirus
1258150965007519744.png,any
1042237339685322752.png,the with votes confirmed plan secure necessary remain whether republicans while will have about should private fails some draws that confident discussions there been backup from process many among
1245401948464877571.png,the with votes confirmed plan secure necessary remain whether republicans while will have about should private fails some draws that confident discussions there been backup from process many among
1247045705732161536.png,treated either patriotic names circles arrogant all misinformed weekly sick absolutely retarded wrong like people who ted things causing going being carry review are start shit naming these
1244749642954399748.png,states yes treated reported either covid patriotic names fatality circles arrogant all misinformed germany weekly sick case absolutely non retarded wrong italy soon like 19 tone people who united china ted mainland son things causing going korea being carry south review toy rate eat france are start pain bert shit rates ions naming days these
769244002554044416.png,fatality beasts bracket back san classified income segments italy blacks making fastest 19 winners group population sure korea from rate black only pain shrinking period declined within growing decline just germany fourth hand other steadily this over people been clear eat middle bert rates ions has days the misleading into increase covid had even graph percentage have growth but china mainland far ted above experienced saw was dividing between france are families segment states fasting reported upper earning intervals and those range case using united declining son that not class true south since highest
1252581503843926017.png,beasts san bracket back classified awe income segments blacks making fastest 19 winners group population sure from rate black only shrinking period declined within growing decline just fourth hand spreading other steadily this over people been clear networks middle has disease the misleading into mobile increase covid had even graph percentage have growth but ted far above experienced saw was dividing between 5g are families segment fasting upper earning intervals and those see range using coronavirus declining that not class true countries many since waves highest
1248135980562944000.png,spreading 19 atom have 5g mobile that coronavirus health covid not waves countries information mate disease networks many
1228365678777962496.png,atom ace fake seat the health era dart ames her ore terre information rag err coronavirus
1248765221771984896.png,the dart ames terre danger rag err
1236333891662815232.png,the outbreak find place princess powers and totally had personnel even distribute initially hospitals diamond chaos our for sick travis first physician this put non infinite then yet patients area bunch sickest haven hospital house winging generating who told their right that them decided was patient they next one since wisdom got everyone danger military why
1253605866344873984.png,age the outbreak find place princess powers and totally had personnel even distribute initially hospitals diamond chaos our for sick travis first physician this put non infinite then yet patients area bunch sickest haven hospital house winging generating who told their right that them decided was patient they next one since wisdom got everyone military why
1166038404573859845.png,newsletter with finances hundreds thought center reduction through issues child simple produced play imagine action behind beneath london programs important recognized truism asked what process they activities terms sign part contact which faq general highlighting age theme revolution say active goats september spreading inception will meditation role embodying ideals you two couple new community might communications people trust their nation risk stories follow lie economic york structure understanding search seminar read internet educational its history has hours instrumental the news camel working nature nations updates information comes governmental for have creative video regular matter support non impression does direction progress status geneva things council disaster towards processes talk thinking such are represent peoples marco importance out goals letter world everywhere therefore mailings functioning and year voice based particularly arcane surface about energy materials well later goodwill technologies united willis social that not department question conditions consultative involving seminars there languages many answer much when characteristics fostering since actions light given public
1246010707822419973.png,newsletter with finances hundreds thought center reduction through issues simple child produced play imagine action behind beneath london programs important recognized truism asked what process they how terms sign part contact which faq general highlighting age theme revolution say active goats september spreading inception will meditation role embodying ideals you two couple new community might communications people trust their nation risk affect stories follow lie economic york structure understanding cancer search seminar read internet educational its history has system hours instrumental the news nature working nations updates information comes governmental for have creative video regular matter support non impression does direction progress geneva things council towards processes talk thinking such represent peoples marco importance out letter world everywhere therefore mailings functioning and year voice based immune particularly arcane surface about energy well later goodwill technologies united willis social that not department question conditions consultative involving seminars there languages many answer much when characteristics since actions light given public
1245864320191193088.png,pet how the immune fig data beet cancer affect does organic system
1171134605614821377.png,organic jaw pet beet
1235519327962419200.png,the children measure primary just covid closure all minister our immediate aided private spread schools amongst 19 directed deputy chief reeled prevent possibility till government delhi has jaw
1247110424098672640.png,the children measure primary just covid closure drugs all roll our immediate aided private rock spread schools amongst 19 directed digest reeled prevent possibility till government delhi has ray
1251038023640203265.png,roll rock drugs ray digest whaler
1245243349906440193.png,mall questions been answering
1253584501361373185.png,awe jealous questions became answering truck nearby ice mall been jaw cream
1256112366124744704.png,awe jealous became truck nearby ice aaron jaw cream
1249930072838098947.png,pry government continue current face are fate guidelines wearing reviewing aaron masks
1236906077104431105.png,continue current face are guidelines wearing boo reviewing government masks
1244602911084154880.png,cram
1252720441485033474.png,
1233414293158334464.png,the world use waste animals caring and pea handling visibly getting your for sick role sneezing you protect toilet health wash fee dirty from organization yourself hands when earl food are animal prepare others after
1223797678070321152.png,the news down workers waste animals caring tibet pea and wuhan cracks handling visibly thousands your for sneezing sick you home editor debts private any protest pick rave china firms wash dirty set hands when ire earl bode food plans moe hume prepare ray organization after
1239452927808483329.png,workers down waste china firms plans editor and hume wuhan cracks private protest any thousands pick
1222175258456674306.png,5g leading innovation
1258052109989294080.png,guts with net confronting place consequences equipment elena april under vitus mats antennas moving hue nose shy cake formation innovative our issues congress snare ion pence forced reason share spin won calls where italy serene unemployed aver bee 19 market ban pens leading would sees computing bald ron boo avon coordinate wide fees mile set from investments bean international maker became profit mane across electronic act vat meant aggregated sect equal age faster sea last needed lone heroes months ever global all fire recovery published will percents public privacy other conversations you points integer cased des new this cents pace must region communications europe living telecommunication single seat awning courage their health eats satan stories been trade buster follow followed economic systems edge funding ace industries ads committed continue eat bud financial struck its she canceled fight eliminate the news real working annual provide tau sears antennae mobile domes born covid cancel jet change estimate handling ned indent aft for competition union rules have media paces video weeks roughly fare pal con more acute mann practice conspiracy growth spread barcelona seers digital address but often governments needs far cove strain compel were soy crucial dig grass network was resources backbone sharing between 5g better medical attack are swore guidelines purpose world workers seth principles harassed adaptation rainy underscore organ pent and innovation year agar before wane virus those irene ending unprecedented best help align promote decades determine about economy rang strengths eight industry throughout gaps leaders coming fake data infrastructure sense strength social than that fast commission around bus sues countries tom conditions european there aged sorts hat combs stars copies profound many takes thea current tie actions challenges globally threats examined parapet meet which
1237913832657387525.png,elena april ending mats shy cake formation our snare congress pence serene aver bee 19 ban pens sees bald avon fees wide mile set bean mane vat aggregated sea age faster lone all recovery pace privacy integer des cased new cents europe seat awning eats satan economic ace eat she canceled sears the antennae tau hue jet cancel par aft rules for paces acute mann practice barcelona seers spread far cove compel soy backbone 5g swore seth rainy organ pent and agar before wane irene economy rang eight fake bus strength sues hat stars sorts copies thea parapet meet
1227028619731636224.png,nan same reported confirmed fatality seams san cases bays all zoe sane sao case china mainland poe rate wan roses seam days land sam
1246131279260782592.png,nan same reported confirmed fatality seams san cases bays all zoe sao case china mainland poe rate wan roses days land
1248656992442482689.png,the for weekend scot that worth stressing easter especially creed coronavirus
1224203360254951424.png,the for weekend scot that worth stressing easter wage especially creed peat coronavirus
1245728820407255040.png,either covid really type round virus could looks aft this globe like kind tow hall going lied wage peat
1256736227249631232.png,aft could kind looks like either ear covid this really tow globe going won type round virus lied
1222426523707289600.png,ear won
1235071336860413952.png,wane feel mere
1244260574780723200.png,the world outbreak every wuhan global researchers wane all now based for have face always feel does solution developed coronavirus china health successfully that around forces recently including was from many very struggling ongoing almost joined problem originated fight
1249058824851525633.png,the world outbreak every wuhan global researchers all now based for have face always does solution developed coronavirus china health successfully that around forces recently including was from many very struggling ongoing almost joined problem originated fight
1246113749565612035.png,
1252104677702975488.png,err poe siena eases
1236073421420847104.png,see eases eke err siena
1240329170426658820.png,items with otherwise cree governors possible oat facilities tissue restaurants shopping dee surrounding critical feel where school can bee federal sees young population from travel hands groups activities part frequently supply ores after healthy used discretionary tried associated all retirement deter accelerate other you hid community areas identified closed evidence people transmission risk elbow wash near fee item slow been follow avoid state halt has term others indoor the into operations increase inside neighboring employers courts even trips doe cough cued for have close spread address eating needs ted drinking care maintain food are work any guidance sneeze states special homes and especially services your particularly long see need surface affected should communities visits industry schools coronavirus touching local peter outdoor infrastructure nursing social that aged addition bars much congregate localities older schedule
1256918347146563584.png,items with cree oat possible facilities restaurants shopping dee surrounding critical where school can bee federal sees population from travel hands groups part frequently supply discretionary used tried associated deter retirement you community areas closed evidence people transmission risk wash near slow been follow avoid state has term indoor the operations neighboring trips even courts cued for have close spread address needs ted care maintain food are work any guidance states special homes and services your particularly long see need affected should communities visits industry schools coronavirus touching local outdoor infrastructure nursing social that aged addition much bars congregate localities older others
1243943655511130115.png,
1244693501255745539.png,
1254013009988587520.png,the news good message instead and counter advice content privately help ask causes report you someone twitter quote platforms share remove well tough spread official posts don fake times scientific that them promoting group reply not drown sharing asking engage know out block
1233051272992915461.png,otherwise senate america advice privately border prevention ask congress share fallow posts federal appropriated group wax bill assembled act section combat enacted instead bat all other report you someone quote platforms tough following lives ware cited wall health them promoting reply develop funding read asking per disease block the news message funds plan heal content may hater priori session remove spread official house don short obligated provision sharing engage any know out referred good states law depart and help causes human well coronavirus fake times united scientific that not department order title drown transfer twitter available
1255555984937717760.png,closest the age states enacted law depart senate cause funds plan and heal views border prevention all may comes immunity endorsing hater priori your sampling gender congress survey income weights fallow can following weaken region coronavirus applied house cited wall united federal short health appropriated statements cellular cannot not department provision sure title sickness quota networks funding bill assembled 5g race attainment fielded read census educational act per transfer any section symptoms which available
1238492617345839104.png,closest the age cause views and immunity comes endorsing your gender sampling income see survey weights region can following weaken eke applied statements cellular cannot not sure sickness quota networks race 5g attainment census educational symptoms which
1254244369382678532.png,the same with never seeing and had ever nurses once for wore see have physician weeks regular least can masks pneumonia over like hospital don primarily times people their hardly faces keep not were colds going been saw hospitalized was truly many they such goes life bronchitis rarely wearing touch
1244854971893309442.png,the same with never seeing ante and had ever nurses once for wore have physician weeks regular pies business least can masks pneumonia over colt like hospital don primarily times people their hardly faces keep not were colds pushes going been saw hospitalized was digest truly many they such goes 5g life nina bronchitis piss rarely wearing asia touch
1233973157138239488.png,coughing the fever shortness approximately with animals ante and mouth anyone breath nose breathing virus cough wild hand dry based kidney sneezing tissue week alcohol clean close farm pies leads business headache soap cover like hospital some people requiring treatment usually eggs pushes cold water followed avoid begins digest live hands when 5g nina one contact rub failure cook which unprotected flu thoroughly meat symptoms after difficulties
1248389946106249217.png,coughing the fever use shortness approximately with animals and mouth anyone breath nose breathing virus cough wild hand dry based kidney sneezing tissue week alcohol clean close farm leads headache soap cover like hospital some people requiring treatment usually eggs cold water followed avoid begins live hands when erie one contact failure rub cook unprotected which flu thoroughly meat symptoms after difficulties
1257650971309559808.png,the erie use
1247180420459958272.png,
1245790079869521920.png,eel
1042027426799386624.png,items picked tariff fades sale for bounce ross tensions gaines least eel washington were dollar dips gas disruption intensify any
1244933580914151429.png,dips for items bounce ross tensions washington were gas disruption dollar intensify least picked tariff fades
1252655451621093378.png,
1246533740588826624.png,bane one
1169964223687868416.png,one
1248311191954472968.png,rig
1250122647016439808.png,rig resource
1226802437916262402.png,resource
1254677035424907264.png,radio april mobile infected cree covid mouth lee nose spreading through have eyes sneezes fact yet spread can coronavirus 19 touching people their person cannot that coughs not countries erode also networks travel many when respiratory 5g eye mat covid19 waves speaks viruses
1246222515627794432.png,mobile ike infected cree covid tale lee spreading for have ones book canada fact spread coronavirus 19 walk person that not countries erode networks many when 5g eye mat covid19 read waves
1225203644481646592.png,the confirmed under tale whether cases will for determine ones book canada case new least testing coronavirus city walk people york negative february take count read are pending total positive investigation hours
1249138899504553986.png,the confirmed under whether cases will determine case least testing but people negative they february take count are pending positive investigation hours
1247763125065007109.png,but mel they
1235013622918610944.png,notified with show our visit 19 defined quarantine from they contact safety period supporting additional attention looking updated march tested time details enhanced today you cleaning off this seek employees notification over received brazil experiencing transmission health risk them feet recover priority assessed being please stay has symptoms prolonged the news top confirmed inside covid information building went for earlier dear close more seattle office were was resources individual february are medical mel work positive know guidance out and entered meters amazon based your human employee feeling affected case home remains includes low offices closer who that than not there deep tuesday since continuing which
1247767379167178752.png,notified with show our visit 19 defined quarantine from they contact safety period supporting additional attention looking updated march tested time details enhanced today you off cleaning this seek employees notification over received brazil experiencing transmission health risk them feet recover priority assessed being please stay has symptoms prolonged the news top confirmed inside covid information building went for earlier dear close more seattle office were was resources individual february are medical work positive know guidance out and entered meters amazon based your human employee feeling affected case home remains includes low offices closer who that than not there deep tuesday since continuing which
1246500736021794816.png,the forwarded heard just let had all sorry you stubborn send hope share mind don that please one problem
1232278090052538368.png,the forwarded han heard just let and had all hand awe sorry you stubborn send hope share mind don that poe please one problem
1255922084557000705.png,awe the 5g han and conspiracy theories
1121225736847876097.png,the rights white had wait for after two alabama beating him conspiracy theories beaten civil pick crew treatment would roe wee being activist 5g cow mob hours james
1219455169861079041.png,the rights white had wait for after two alabama beating him beaten civil pick crew treatment would roe ore bias being activist mob hours james
1255149850355621893.png,help rye canada invites develop researchers san
1228980015930343425.png,help rye canada develop san
1245121975720259584.png,ant beet
1251156982033117191.png,sal ant beet
1240510921111461888.png,confirmed covid huber sal worldwide iran phase cases all germany spain ovid model lass italy growth fatalities 19 china exponential korea wee international france total days
1257958324718333953.png,scheme confirmed deployment covid huber subsidy worldwide iran phase cases all germany spain ovid for model lass encouraging italy growth fatalities 19 china early korea wee international 5g france total days
1247489162619637761.png,for scheme early 5g deployment encouraging subsidy
860858594526470144.png,
1243591288374599683.png,aim west fat rae pay pal jet his mae hill wan
1231942559745761281.png,aim west fat rae pal jet
1181541603061706752.png,rag technology chinese are
1247151492521267200.png,die dee are chinese technology
1250748795429818368.png,and die call dee
