filename,terms
1242083844075008000.png,description the green radio states approximately advisory west sugar zone and march possible miles bank emeritus whether border virus try for november longitude cynic national ether virginia more square professor responsible communications via but 19 gated federal united quiet contests commission that frequency established harmful not question docket interference voltage here management was from being activation state observatory black manual between map 5g raised pall read per bounded rather procedures land
1244499735853109250.png,the lung and whether invisible virus iron try for your red sky ether more responsible thomas particles via coronavirus but gated 19 sit contests that oxide not question here dust being activation 5g raised pall read attack rather lungs ocean
1246829298486476801.png,gun hare same with loved photos lady 19 going director from wound live they sister listed photo investigated lungs day just heard phone invisible iron other red died broadcast ones fold comment this over people sit their oxide been write state cites die deaths she has ocean the covid anyone glenn add have sky aster particles were telling dust shot 5g family heart attack out numbers law lung and your need her thomas coronavirus like coming said victims who told that not there did rose sort ire funeral thing
1244710259874242562.png,the same with just heard and covid phone anyone glenn your add other have died need broadcast loved fold comment photos aster lady like 19 said victims who people their that not were going been telling shot from wound live state they rose sort ire cites did listed die heart photo investigated deaths attack she funeral day has out thing
1247539288155144199.png,
1252917885686747136.png,led consuming with hag funded shocking dangerous turn what from affairs event chinese deadly sea lab just now you this ether their been grant million sara truly state rain funding apt its has term disease the news money experts inside rae sad may for have support more exercising research but look governments china caution paper got government originated out and update years believe virus pun hear about infectious coronavirus than shop that involved many mary when bomb speculated collier others
1246867875807330304.png,the news led consuming with experts hag lab inside rae and update years sad believe virus pun now for hear you have about fear this support more funded exercising shocking coronavirus research but 19 look china caution shop than that dangerous turn from grant million truly state mary many when cow paper its speculated event got collier government term others sea
1244314597533892610.png,cow
1254025149998944257.png,wag
1247792787505872896.png,trafficking led children same rue with ruts episode vie document purr tar scotland child car dee behind side london cop presenter err bee met evil sexual what interview exposes former wong shadows prone wake wilfred think eyed parser really police revel bat vermin rod freer rena crime must abuse tree ritual satan jon forces rings fob pan read pacer pals rains depth chicana satanism incredibly the top dark sir doe sacrificing eva pal happening power cairn gear but john spent again stan dad one protection are corruption protected screen detective and dome political human see ton satanic suspect cover squad ten establishment son epstein ames true pole level wag light hens meet
1247020948311560193.png,trafficking the led same children with rue top screen episode prone vie detective eyed parser and really meet revel purr police dome sir rod political see car child ton eva behind satanic side cairn rena crime must presenter happening suspect cover err bee abuse tree but john ritual met breaking ten evil satan son spent establishment ames true what interview dad level pan exposes former are light wong pals hens protected wake depth wilfred incredibly
1240688279051071496.png,
1252827288925638657.png,
1246476081357611010.png,license chairman generation month country november spectrum national critically nigeria federal would study from process concluded part statement attention security deployment fifth ministry deploying currently public reporting other report fully communications received team health commenced frequency been invited economic networks concern teen directed has review the experts mobile participate ensure for earlier clarify office digital nigerian trial released council issued management also agencies 5g regulator development any follows these and sean technology based about economy like deliberated commission that not order press implications records drawn ongoing bulk which available
1248493546421641216.png,license chairman generation posse month country november spectrum sao national sates sag critically nigeria poe would study from process concluded part statement attention security deployment fifth ministry deploying currently public reporting other report noll fully sum veer communications aye soap received eras team health commenced frequency oases been invited networks concern pong teen sun directed has review sears the experts mobile participate ensure for earlier sonoma clarify office digital nigerian trial released council wee issued management also agencies 5g regulator development any follows these and technology based about economy cover like deliberated that not order press implications records drawn ongoing bulk oven which available
1239387203433713664.png,pong noll poe aye sonoma sag cover wee soap
1252737594045202432.png,poe are
1249709258578571264.png,poe
1246881588174086147.png,the too eliminates same with severely use green within radio deployment ante dense and limits kilometer possible reuse space all free while absorption for dry blue air spectrum figure millimeter transmitted range energy region makes relative absorbed oxygen high frequency interference enables operation relationship wave also traditional frequencies atmospheric very distance localized percent between one benefit detailed per illustrates terminals
1250139135832186881.png,the too eliminates same with severely use green within radio deployment ante dense and limits kilometer possible reuse space all free while absorption for dry blue air spectrum figure millimeter range transmitted energy region makes relative absorbed oxygen high frequency interference enables operation relationship wave also traditional frequencies atmospheric very distance localized percent between one benefit detailed per illustrates terminals
1246561438006730768.png,absorbed energy
1246229605586857984.png,absorbed brought energy this radiation party
1237247486311501824.png,this brought radiation
1248056737233592321.png,the with inside rae carbon cruel and pilgrims harvard pressure delivery air patriots darpa see wit source pal rum con funded professor then eel can stimuli conversation normal mae coronavirus target sesame heated trust molecules person wireless harmlessly released recently causing excreted ore water reel immunization sneeze sewers navy from live army ace beverage charles anonymous eat 5g seas rely contact lien bum society foes infect mel work suspend system
1247031088721072134.png,the with carbon cruel and pea harvard pressure delivery air patriots see file source professor then mae can stimuli coronavirus sesame heated found molecules wireless released recently not causing ore water sewers reel sneeze from beverage charles anonymous 5g mel infect work suspend system
1247054869028122628.png,the world radio upgrade electromagnetic covid pea every time introduction messes clearly field breathing pattern see file you spanish cholera 19 caused people found not gets 5g its launched waves influenza flu
1252640893401792512.png,provide the world radio upgrade electromagnetic covid every time introduction messes clearly field breathing pattern boy see you have user spanish body using mae cholera 19 caused people data sense pope bay title eaten hash gets fat 5g its launched waves influenza activity flu generate score system
1247957681702350851.png,the account global pro have body promoted mae using official suggested data leading placebo pope title eaten welcome fat activity twitter score system
1242737283352203265.png,suggested the pro leading account placebo promoted global twitter eel official welcome
1246455183187628037.png,the news coverage theory ass ago for fail this conspiracy eel spread coronavirus don accelerating cell not causing 5g fall
1253004041682145282.png,the news coverage theory last nest ass ago best for wideband fail ely this oaths parke bennett owe conspiracy hen spread coronavirus don disclaimer pens eats accelerating cell that rower not spruce causing nay pork sure walnut nelson set stave 5g riser park mel fin acre rat wider whiter heiress
1248007036144508928.png,southern the news aim last coverage campaign say covid and hundreds those best for wideband businessmen have officials african oaths parke community more discriminated testing city local 19 disclaimer leaders china told health that comments rower spruce sure been here walnut nelson from being evicted they stave riser 5g residents read park africa apartments fin are shares rat hotels whiter against heiress
1246081375180120066.png,southern the news aim campaign say covid and hundreds those for businessmen have officials african community more discriminated testing city local 19 leaders china told health comments been here from being evicted they residents read africa apartments are shares hotels against
1245166831091904513.png,the masses you sometimes become has follow lie
1221428849881370626.png,giant the splendid masses used sometimes mobile online become time wuhan technology for scenery you first video cherry friday people outdoor china blossoms made follow lie was stream supported 5g daily chinese millions has available
1247658136523034624.png,the splendid used mobile wuhan time technology for scenery first video cherry friday people outdoor china blossoms made was supported stream 5g daily chinese millions giant available
1246773929873756166.png,
1239796207788097538.png,can
1247156587669737473.png,can
1247199972086464513.png,
1233017156331327490.png,they your people with peel are pete bye body wake invading
1246794245261996036.png,people suit with sap war bye wake
1037704685652561926.png,transformation cellular installed sap base lot evolution 5g erg eat society see millions personal global business units devices
1245873817010024448.png,transformation cellular installed base lot evolution 5g eat society see millions personal global business units devices
1249592486160470018.png,use users conduct response bank consumers border own through regions book cities taxes third transmitting travel benefits supply identity online farmers secure verify control platforms transactions enhance people vote provenance their health carry smart sensors congestion financial value the chains trips logins for media telecommunications commerce citizens monitor digital party access interactions treatment heath service care network such between food government out providers produce insurance and payments login usage services collect energy accounts business open data demonstrate social that shop countries mobility rely devices
1240441174843740160.png,use users conduct response bank consumers border ease own through regions feed dane book taxes third transmitting move travel benefits goes tea supply sea identity secure carver control platforms stole transactions enhance people provenance their fee cater smart sensors congestion financial value the teem trips meter logins for media telecommunications commerce monitor digital party access heath treatment interactions service care network such tier between food recite government out providers chester congo produce insurance and payments usage services energy accounts business open data demonstrate social that shop countries tom rho setter mobility rely rats devices
1246725765003194370.png,the locations capacity coverage with experience essen columbus plan america and boston teem boise speeds meter gore building cases stores ease now country for wideband most see fed built charlotte stole cities support together more this select where chicago can parts low people massive fast right shop poe atlanta cove tow powerful latency cater move network from setter live tier rely ape cincinnati recite 5g ultra plans across cleveland phones soar sea
1242756453687070720.png,the fever capacity coverage with experience essen columbus plan america and boston boise speeds gore loss building country pressure cough breath chest for wideband most fed built charlotte cities this support more select where chicago mood can infectious pneumonia blood parts low people massive fast right shop poe cove atlanta tow high latency network main rate live rely cincinnati cleveland 5g ultra eat phones pain lungs symptoms sings
1246732878555295744.png,low pneumonia symptoms with high cough infectious pressure main
1246351431508115457.png,science and
1246133957764288517.png,tens the 19 agate teas map 5g one vie bigger always science and mont texas picture coronavirus
1237393198458130436.png,tens the agate translate teas map bus 5g one bigger always aged picture coronavirus
1240610610892677121.png,translate pot bus map 5g confirmed cases aged virus
1245998196050014208.png,electromagnetic microwave loss pattern issues behind headaches irregular where metals sleep province tremors high sensitivity sperm exposure nausea leg bronchitis pain metabolism dizziness chest cases facial damage altered disorder restless mood pneumonia miscarriage difficulty people trust chronic tow asthma syndrome flu symptoms the decreasing sugar confirmed abnormalities personality depression add joint enlarged muscle foot body concentrating hearing burning fatigue rash hair was stan sensation flushing 5g heart anxiety deteriorating digestive abdominal illness and wuhan insomnia increased virus pressure attacks vision immune inflamed eyes leads tingling like low skin memory leukemia map brain eye waves
1245999759250403328.png,electromagnetic microwave loss pattern issues behind headaches where metals sleep province tremors high sperm exposure nausea leg bronchitis pain metabolism dizziness chest facial damage altered disorder restless mood pneumonia miscarriage people trust tow asthma syndrome flu symptoms the decreasing sugar abnormalities depression add joint enlarged muscle foot body concentrating hearing burning fatigue rash hair was stan sensation flushing 5g heart deteriorating abdominal illness and wuhan insomnia increased pressure attacks vision inflamed immune eyes leads like low skin memory leukemia brain eye waves
1247190234523226112.png,abet video play wag isis was
1258541410896146433.png,abet with place however removal allow describe safe our resulted flagged play reading important can disappointing still sure upon from terms take additional think details all you another this community might removed restrictions lead allowed has review against money account content breaks appeal even may could for rules video more remove encourage but don look termination result service penalty made was make guidelines know violates violations line strikes encourages and strike your that keep not mistake impact determined others which
1230238970388328448.png,with place however removal allow describe safe our resulted flagged reading important can disappointing still sure upon from terms take additional think details all you another this community might removed restrictions lead allowed has review against money account content breaks appeal even may could for rules video more remove encourage but don look termination result service penalty made was make guidelines know violates violations line strikes encourages and strike your that keep not mistake impact determined others which
1258467150207090688.png,
1236184595005140992.png,eat what
1248299666090921990.png,wee sees what see
1254207898382667776.png,loser wee from sees
1247413863043170304.png,the yes use cause types and has possible years give classified for human other causes different off send can later signals like research rays don agent health cell emit that harmful sure from carcinogen international agency problems cancer radiation phones know
1247627198388936704.png,the yes use cause types and has possible years give classified for human other causes different off send can later signals like research rays don agent health cell emit that harmful sure from carcinogen international agency problems cancer radiation phones know
1246426788575744007.png,real toll botched cat death
1245798266937192449.png,the real toll ton 5g botched eye infected banned tests head via death
1247164314303201281.png,the 5g eye infected banned tests head via
1257289279660863488.png,
1248737154936651778.png,per
