filename,terms
1248204330018025473.png,world fat ted 5g intelligent axel fully capital building was
1242280758691184646.png,world moored fat ted 5g intelligent fully oak capital building
1251873512710721537.png,moored censor slater don theorists love censored tom conspiracy theories being
1227636147033010176.png,apple until reopening will for bead conspiracy theories closed theorists love health due being further please current dates check censored notice retail precautions
1243872770905247746.png,the nationwide scoff dismissed apple until and covid way police ass reopening yesterday tourists will for first enforcing bead sack closed 19 times health comments defy due sickness further live authorities please they town current taunted dates residents its check started shares notice streets retail cape day precautions
1247480547108061189.png,the nationwide scoff dismissed covid and police ass yesterday tourists first enforcing err 19 times comments defy sickness live authorities they town taunted residents its started shares streets day cape
1238686506048462848.png,err rears
1255316597771829254.png,pay
1246068206055215104.png,pay
1246588681667907590.png,mute
1255572078792773638.png,the world experience say and picked promised best cost will you twice site buyer another her headache delivered pick out mute far star not half reply going thanks was yourself quality receive dud check she seller name review awesome
1234590882143363072.png,the world experience education say hal and pea picked all promised ale best cost will camp you twice site buyer another her headache delivered pick out far star not half reply going thanks was yourself quality receive dud check she seller name review awesome
1249227595264094208.png,the ere yes months plan just pea dollars hundreds time begin and really pines thousands ale hospitals will for camp you pete mind then restrictions eke yours seed like taker don people pie because portrayed things not reply question still tell there pen ceased what empty care did they how without sight paid end pay are tighter allowed having property
1238652219479789568.png,the ere plan just and dollars hundreds begin really thousands hospitals will for you mind then yours vies like taker people pen not question care still reply there ceased what pig empty did without paid end pay are allowed having property
1245544126616965120.png,alone and physical get all your through nothing week loved canada ones this together vies reply pig been from maintain how distance kindness exciting hard know connect
1230167594893742080.png,the alone think under just and physical get really those all comes values free cost your through for privacy week loved canada ones this together huge gain but people short freedom that speech not reply wet there been from set hidden maintain how distance kindness liberty terms 5g offered take financial lynch duty unite hard know term connect
1221842155695759361.png,age the think under just really those values comes free cost for privacy reading bye debating huge gain but house people short freedom that speech pray not there second set hidden funding commons liberty bill terms 5g offered take financial lynch duty unite are parliament term
1249929402827378688.png,funding the house commons bill pray are reading second parliament debating
1249978078102683649.png,the electromagnetic into cause think say harry possibly fool nonsense virus give getting bullet for points sucked media conspiracy can spread but helpful that not his likes was point without somehow waves twitter maybe why
1254256345752223746.png,never electromagnetic harry fool election give nobody women bullet candidates running face assaults can helpful republican sexual asked his likes assaulted clinton without bill became day hard trump cause think tried say americans heard instead let ever will other points sucked voting two this similar rape says allegations man tell credible committed she has the into participate accused getting for media support more conspiracy spread but upset were choose was point somehow between juanita supporter maybe both democrats and possibly nonsense virus whom assault about her who told that than not cynically there when story tara waves twitter why
1247426046808465410.png,the never both tried instead participate americans heard democrats and let ever election accused nobody women will candidates other whom running voting two assault about face this support her more similar rape says assaults but allegations who republican told sexual upset than asked not were man cynically there tell choose credible assaulted supporter clinton when bill story committed between juanita became eat tara she day hard has trump
1248774296039645185.png,
1246422545840119810.png,the people for who have sadly died april across tested update been positive those which coronavirus
1249593225087799296.png,the people for who have sadly died april across tested update been positive those which coronavirus
1247849440490258432.png,how images your news family maps ore divorce all
1248713926822502403.png,how images your news family maps divorce all
831849188103163905.png,
1248869447051423745.png,
1245471053289226242.png,the same camera woman attended and wuhan years had investigations onset tourists arrived other january earlier cluster occupied patients closed respectively developed 19 local symptom visited who seat china church that man not were captured symptomatic attendees aged reveal from patient did they february three persons day circuit any singapore symptoms subsequently
1226420227103047680.png,the ere same camera woman attended and wuhan years had sean investigations bat onset tourists arrived bees sane other january raw earlier cluster occupied patients closed respectively developed 19 local symptom visited who seat china church root brace that pie man not were captured symptomatic attendees aged likes fatal sure follow reveal from patient did ram they february three cabs one persons day circuit any singapore symptoms subsequently
1246169437058842625.png,ere sane pie cabs brace keep say fatal sure sean likes follow bat
1038620252177948675.png,the want easily yes with into say startups junior let and venture just get convince even amazon comes try kill most have era correctly corporate this new word business important can 19 capitalists unconstrained their nimble keep that executive chain traditional slaughter they takes explains whole hierarchy disruptive any boss idea why
1235971391587041281.png,the want easily yes with into say startups junior let and venture just get oat convince even amazon comes try kill for most have era correctly corporate this new pandemic critical word business important can 19 capitalists unconstrained their nimble guide that infrastructure key executive chain resources traditional slaughter they takes explains whole hierarchy influenza disruptive any boss idea why
1241621890755629058.png,the illness refer campbell just covid and oat byline virus jill for your jukes you twitter explained pandemic this critical ill replying following throughout piece coronavirus 19 caused times peter key infrastructure agent right guide that not from resources article covid19 one read started influenza know
1253217163386580992.png,the illness refer campbell just covid and hal byline virus technology jill your for jukes you twitter explained this ill replying throughout following piece coronavirus 19 caused times peter agent right that not panic wave from fresh 5g article covid19 one read started know
1248502237996843010.png,fresh technology 5g hal panic wave
1248625428849258502.png,
1252831446785380352.png,
1246612629193359360.png,
1245447463181283328.png,
1238751391692161024.png,the imported dependence average and country figure share bee indicator china eaten exposure distance benchmark dependency input between bra chinese total
1245009036757602305.png,the imported dependence average and country brave figure share bee indicator china eaten exposure distance benchmark dependency input between chinese total something
1243973199827808256.png,tape spree one say roe mae brave sins
1246886047117537280.png,tape spree medicine new create roe formula bead peru
1255190967033843715.png,bier met woe see ate oars fee bead peru
1240958628854525953.png,19 crisis opportunities met bier see oars covid fee challenges and woe from
1223302921825198081.png,19 ere opportunities covid challenges and crisis from
1248166995238977536.png,authority
1250077761781272577.png,the stupid bovine full dense ignorant pea brained dead dump shilling dull simple two foolish vacuous insensitive short not half pig dim idiotic slow empty planks headed wooden fat brain minded mindless dumb authority thick naive
1256185215451627522.png,the stupid bovine full dense ignorant dump pea brained dead may dull simple two foolish delete vacuous friday insensitive short not pig idiotic slow empty planks headed wooden fat brain minded 5g mindless thick naive
1247557016937209856.png,the working coverage register mobile online and update possible updates information masts repair may currently unfortunately your our for most have you need visit case this delete keeping more connected area automatically friday thank local focused checker experiencing team customer status service that hello care means experienced network please when mast quickly sadly 5g one engineers are sent detailed disruption hard
1234524871226482688.png,the working coverage register mobile online and update possible updates information masts repair may currently unfortunately your our for most have you need visit case this keeping more connected area automatically thank local focused checker experiencing team customer status service that hello care means experienced network please when mast quickly sadly one engineers are sent detailed disruption hard
1245700008453734400.png,
1232845274948816896.png,sol his
1250688776122368000.png,rescue children consumers trends denying casts supervision erg acting educators national handles word important high past upon process how without part ouch event act fate shaping silence identity lines phone peddle cases senior you unfounded hid new similar confusion responsible tiles covers allegations sit ate them sift fee causing toned executive been basis teams hoot gave idea money covid adopting threatens functions even ensure mercy enter form oversight have taxpayers prompting teach kong support bully research defiant eating far released regulating cares fog issued such legislation disdain arrested government empowered targets seth eyeing homes ike get year services your businessmen misuse suspected about case transform temperature promise theories said social that than publication latched press south main profound deeper asian painted end reasons highly authority ugh others tearing sat procurement place members way deed show nairobi give gang ion theft feel spike interesting ahead reaches 19 some staff humane fraction protested planes ear unconditional vehicles andre hall korea break reassure lied regulatory among challenger spiting general related explore writer plot damage reacting wit students indeed view yet says over heir their molecules unacceptable man cat damages idle cargo ace lest butte she setting block confirmed increase tim had creating airlines ale officials editor vied more actively rough digital yeas crew don leary governor businessman latency image point agency kindness evident privileges these threat revised reported earning and wuhan maine author remain virus fortunately deal rand allan immune need ant should fact headache heather hangout outlining suspect city technologies leaders low created nowhere data commission county terrorism not hat cabinet consulted game seas looms complexities drug specifically fence hare use base however threatening under teachers debate safe country ease teens tissue child week where exception rooms would his what director from they international abnormally understand take radiation carrier small supply spurious divide chit infighting eli outbreak used microsoft cause surprised miss time polls misplaced number all germany sane report this sum communications several theorists team resolve promoting undermining develop here being state launch eat teaching eng rule sue plan sector while ensuing media seeking warring non exercising body previous but bog antipathy including bands hanger presents allows paper are protection deploy medical fin clearing too therefore nonetheless great thresholds empathy particularly whose accounts logic served who fast department fields involved accommodate when story anymore unites various compare fore public same ties net campaign with took hit ising fuel become renee despite our through dons car regarding sate ely play deployed estates can early metropolitan preparing further begins exposure gangs build epidemic houses urge sol specially fit safety chinese healthy responsibility manager online october associated negro now other most role two rena must parents europe anne triggered people paradoxes recently mad bile carry networks search routes per airways has the find computer into mobile han lanes vic scan pore sad criminal works spain idling telecommunications fear dealt encourage conspiracy then dow peaked visions caused nuclear access false teacher again outsiders anal network infiltrate management death ply 5g one howe guidelines having seven super sill closely revenue wile nat increases detractors regulations sean failing technology secretary parent weekend human web ito reality exposed her somali industry using worlds like sway stem argo because tactic taken wireless around countries order there kenya deprive asia emotional which
641654932135768064.png,rescue consumers denying erg national important high upon process how part ouch act shaping silence lines phone cases senior you unfounded hid new similar confusion tiles responsible allegations ate sift fee causing toned executive been teams hoot gave covid adopting ensure enter have taxpayers prompting kong defiant eating far released regulating cares fog issued disdain arrested government empowered targets seth homes ike year services your suspected about case temperature promise theories social that publication latched press profound deeper asian painted end authority ugh tearing place members college way deed give gang ion spike interesting ahead reaches 19 some fraction humane protested planes ear hall break black race spiting related writer plot reacting wit students indeed yet says over heir cat cargo ace lest she setting increase tim creating ale editor vied more actively rough leary governor businessman image agency these reported and wuhan maine virus deal allan immune ant should headache heather hangout city leaders created county terrorism not hat seas looms drug hare education under teachers debate safe country ease teens his what from they take understand radiation supply divide eli infighting chit outbreak cause surprised time misplaced all germany sane report this sum communications several theorists team undermining develop here teaching eng sue plan sector while warring non graduate but bog antipathy hanger presents allows paper are deploy fin too whose served department accommodate when various compare fore public ties net campaign with took fuel renee despite our dons car sate ely play estates school can early hispanic begins houses urge specially fit safety manager online negro role rena must parents anne europe recently carry search per has the find into mobile han vic white pore sad criminal works spain dealt conspiracy then dow peaked teacher again outsiders network infiltrate death 5g one howe guidelines super sill revenue wile nat sean technology weekend human her exposed somali industry worlds stem argo because wireless order there kenya which
1253733396574015490.png,potash the white education college thread views pea time florida show before strike your have you car this matter protest graduate school huge office some liberate high governor hispanic insult involved listen was front hands black only asian race one joshua got problem southerners twitter minnesota
1234741984998367232.png,potash the thread pea time florida show before strike your have you this matter non protest huge office liberate governor insult involved listen was front hands only one joshua got problem southerners twitter minnesota
1256140929460834305.png,ted norway denmark peek
1236936616599375877.png,ted norway denmark
1247681548687757312.png,the stop campaign upgrade furious security company technology comes most provided diplomatic using says europe fundamental standards their risk around them washington elsewhere countries european move networks amid presents race 5g plans grave chinese which
1248625542569455624.png,the stop campaign upgrade furious security company technology comes most provided diplomatic using says europe fundamental standards their risk around them washington elsewhere countries european move networks amid presents race 5g plans grave chinese which
1244283467665309697.png,19 news wrap daily covid march
1228578610073591808.png,aiken news ran wrap covid march oat few deed airs san ale bees grad can aye 19 key sees seal cord cements cod seas daily seemed ray sea
1230282534384218113.png,ale ran february bees key cod seas seemed event few deed press airs san can aye cord
1237565923520741377.png,air february ambulance event press par
1236423911333679104.png,par ambulance
1245121414090416129.png,agers outbreak top confirmed every and updated march get response ever japan obedience number country cases casts singapore spain rules double graphic india canada case kong johns community closures strong roof italy school huge analysis err trajectories coronavirus civil john research data china turkey social hopkins around university test korea quarantine burn doer how mine mask racing strict contact since cumulative got compare wearing trace days
1251977793086210048.png,agers april cree mouth japan casts country nose double through closures italy analysis can 19 quarantine travel how contact covid19 radio infected every march lee ever obedience number cases spreading india roof yet people their person cannot test erode networks doer mat speaks days top confirmed mobile covid spain rules have kong spread research john china also mask 5g cumulative singapore coughs viruses and get eyes case sneezes strong fact huge trajectories coronavirus touching turkey that around not countries burn many when respiratory racing eye since waves compare
1229921498464505856.png,orr mobile win infected cree covid lee arm spreading cam have rip raw fact user thinks spread arts coronavirus 19 person that not bay rich countries erode networks many when ire 5g eye tea mat covid19 are waves sea
1233891901691985920.png,19 ire rip tea orr win raw are bay rich user arm thinks arts sea
1252182226894229504.png,pad
1247300761563865088.png,
1251089337019662339.png,poe
1170086901845495809.png,the measure and enlivens time opens brown you about resonance home recital calls don love that poe what cares begins transformation when heart finds
1249382598025060352.png,nag the measure and enlivens time opens brown you about resonance home calls don love that what begins transformation when heart finds are
1250515645709590529.png,nag theory 5g retry are con over
1252591676041895940.png,5g over theory
1246357493913137152.png,
1233061501231038470.png,the errs new poet spread coronavirus
1250038673502019584.png,the high errs han new street poet spread coronavirus
1247874455109599234.png,han street sea
1250632201667874822.png,yes sea
1249033373395320832.png,yes with drink renee fled refresh irrelevant landscape directly replying would second move from they across after tears think just all deter you someone new frame intermediary endless dependent people their threads disproves reply compression bloodbath being strewn player the presented claim may particular have video more wrong previous but look hoping achieve frames choose each also point make newer better one are mountain slider fallen already get keyboard coming who told absolute that keep prove not decade starting abandoned piles many bodies warriors decode delicious
1246929011860819968.png,with drink fled refresh irrelevant landscape directly replying can would second move from they across after tears think just all deter you someone new frame intermediary endless dependent people their threads disproves reply compression oar bloodbath being strewn player the presented claim may particular have video more wrong previous but look hoping achieve frames choose each also point make newer better are mountain slider fallen already get keyboard coal coming who told absolute that keep prove decade not starting abandoned piles many bodies warriors delicious
1248168294533574657.png,coal can oar
1251174083259240448.png,the news april andrew covid get response safe back new soon beer drive breaking 19 governor recover his briefing economic york live state nines neon daily giving work
1248645023018528768.png,the news eng vile april relations nat andrew organ covid get tale response post safe back connections see mentions replies tan new accounts wand soon beer drive breaking 19 came eats social governor recover fee his briefing tom network economic york state pest boris wilt 5g pan search daily sage asia giving work twitter seen repeats sea
1240441186847879169.png,the relations organ tale connections see tan mentions fats faber accounts wand toe social fee tom network wee pest boris wilt 5g pan search sage asia twitter sea
1227657884395327489.png,max see jim pioneer toe television pastor mae christian
1245845899881984000.png,max ate jim pat sad pastor mae rite
1246819351740719104.png,the covid and pat sad information swayed gates about conspiracy spread coronavirus 19 some people caused who parading portrayed not there idle ignorance being networks please paragon minded 5g are levels themselves stupidity legendary
1222594062693343240.png,the covid and information swayed gates about conspiracy spread coronavirus 19 some people caused who parading portrayed not there idle ignorance being networks please paragon minded 5g are levels themselves legendary
1242194626397822977.png,the law with fable under adopting and march contents functions repealed auction requirement graph rules for spectrum table other acceptable des obligations con any charge subsection foe communications purposes local 19 don obligation reallocate striking amendment than wireless amended final fee item provision expenditure title break issued such clarifying state expenditures middle tie inserting act which repeal stale flu relating paragraph jaw section public band purpose
1244560985907589120.png,the with fable sat adopting and march auction requirement graph fag rules for spectrum other acceptable des obligations any charge subsection foe purposes local obligation don reallocate striking amendment than amended expenditure break issued such clarifying expenditures middle tie inserting which repeal stale flu relating paragraph jaw section public band purpose
1247140407135408128.png,breaking house news the 19 kenya confirmed covid pandemic new has nairobi cases state
1252288066246471680.png,the news confirmed covid nairobi cases borg taylor comment pandemic new share men breaking house 19 tax write south state kenya payer bet has property
1239985649773621256.png,senate covid chair borg today for taylor comment business 19 tax write south bill convenes payer relief marco small property
1245812319503908867.png,19 today for convenes bill senate covid relief chair business marco small
1239931748139429890.png,
1255890929841512448.png,
1250208190198960129.png,the 19 vida you awake life release covid are code head everyday blood yet
1246742100189691904.png,the 19 vida you awake life release covid are code head everyday blood yet
1224960630085435392.png,same with equipment company accordance safeguard safe prevention our series visit during exhibition staff isolation high self relevant from paid daily safety customers chinese after outbreak additional attention outside instructions time personnel arrival all senior will you control two prior new put areas employees europe telecommunication participating health priority meaningful has symptoms presentation the working organizing corporation isolated ensure for responding have required weeks always non actively least booth china mainland service stand including resources undergo departure are guidelines nationals closely and wuhan believe measures before affected infection strong coronavirus leaders who that department countries addition mainly meetings current level comfortable adopted
